{
  "schemaVersion": "jobservatory.accessibility-audit.v1",
  "generatedAt": "2026-08-25T00:35:57+00:00",
  "target": {
    "artifact": "built Cloudflare Pages static bundle served by Vite preview",
    "routes": [
      "/",
      "/annotation.html"
    ],
    "states": [
      "ledger-loaded",
      "evidence-dialog-open",
      "annotation-package-selection",
      "annotation-retrieval-loaded",
      "annotation-classification-loaded"
    ],
    "viewports": [
      {
        "id": "desktop",
        "width": 1440,
        "height": 1000
      },
      {
        "id": "mobile",
        "width": 390,
        "height": 844
      }
    ]
  },
  "standard": {
    "target": "WCAG 2.2 Level AA",
    "automatedEngine": "axe-core",
    "automatedEngineVersion": "4.11.4",
    "ruleTags": [
      "wcag2a",
      "wcag2aa",
      "wcag21a",
      "wcag21aa",
      "wcag22aa"
    ],
    "browser": "Chromium 140.0.7339.186"
  },
  "criteria": {
    "violationNodes": 0,
    "seriousOrCriticalNodes": 0,
    "incompleteNodes": 0,
    "keyboardChecksMustAllPass": true,
    "annotationInteractionChecksMustAllPass": true
  },
  "aggregate": {
    "auditedStates": 10,
    "rulesEvaluated": 620,
    "passedRuleResults": 256,
    "violationNodes": 0,
    "seriousOrCriticalNodes": 0,
    "incompleteRuleResults": 0,
    "incompleteNodes": 0
  },
  "keyboardChecks": [
    {
      "viewport": "desktop",
      "initialFocusOnClose": true,
      "wrapsForward": true,
      "wrapsBackward": true,
      "escapeCloses": true,
      "restoresFocus": true
    },
    {
      "viewport": "mobile",
      "initialFocusOnClose": true,
      "wrapsForward": true,
      "wrapsBackward": true,
      "escapeCloses": true,
      "restoresFocus": true
    }
  ],
  "annotationInteractionChecks": [
    {
      "viewport": "desktop",
      "retrievalGradeSelection": true,
      "nextTaskNavigation": true,
      "classificationLabelSelection": true,
      "classificationEvidenceDecision": true,
      "retrievalDraftPersists": true,
      "classificationDraftPersists": true
    },
    {
      "viewport": "mobile",
      "retrievalGradeSelection": true,
      "nextTaskNavigation": true,
      "classificationLabelSelection": true,
      "classificationEvidenceDecision": true,
      "retrievalDraftPersists": true,
      "classificationDraftPersists": true
    }
  ],
  "results": [
    {
      "viewport": "desktop",
      "state": "ledger-loaded",
      "rulesEvaluated": 62,
      "passes": 27,
      "incomplete": [],
      "violations": []
    },
    {
      "viewport": "desktop",
      "state": "evidence-dialog-open",
      "rulesEvaluated": 62,
      "passes": 29,
      "incomplete": [],
      "violations": []
    },
    {
      "viewport": "desktop",
      "state": "annotation-package-selection",
      "rulesEvaluated": 62,
      "passes": 22,
      "incomplete": [],
      "violations": []
    },
    {
      "viewport": "desktop",
      "state": "annotation-retrieval-loaded",
      "rulesEvaluated": 62,
      "passes": 25,
      "incomplete": [],
      "violations": []
    },
    {
      "viewport": "desktop",
      "state": "annotation-classification-loaded",
      "rulesEvaluated": 62,
      "passes": 25,
      "incomplete": [],
      "violations": []
    },
    {
      "viewport": "mobile",
      "state": "ledger-loaded",
      "rulesEvaluated": 62,
      "passes": 27,
      "incomplete": [],
      "violations": []
    },
    {
      "viewport": "mobile",
      "state": "evidence-dialog-open",
      "rulesEvaluated": 62,
      "passes": 29,
      "incomplete": [],
      "violations": []
    },
    {
      "viewport": "mobile",
      "state": "annotation-package-selection",
      "rulesEvaluated": 62,
      "passes": 22,
      "incomplete": [],
      "violations": []
    },
    {
      "viewport": "mobile",
      "state": "annotation-retrieval-loaded",
      "rulesEvaluated": 62,
      "passes": 25,
      "incomplete": [],
      "violations": []
    },
    {
      "viewport": "mobile",
      "state": "annotation-classification-loaded",
      "rulesEvaluated": 62,
      "passes": 25,
      "incomplete": [],
      "violations": []
    }
  ],
  "manualAssurance": {
    "status": "required",
    "scope": "screen-reader and assistive-technology review by a qualified human remains separate and incomplete"
  },
  "status": "pass",
  "limitations": [
    "Automated rules cannot prove conformance or replace evaluation by people who use assistive technologies.",
    "The audit covers the primary route after corpus load and with the evidence dialog open, plus package-selection and loaded retrieval/classification states in the annotation workbench at desktop and mobile viewports.",
    "External source pages and downloaded JSON artifacts are outside this UI audit.",
    "Axe incomplete results require review but do not count as violations in this automated gate."
  ]
}
